{
  "$schema": "https://json-schema.org/draft/2020-12/schema",
  "type": "array",
  "items": {
    "type": "object",
    "required": ["name", "url", "category", "scrape_method", "scrape_frequency_hours", "wave", "is_active"],
    "properties": {
      "name": { "type": "string", "minLength": 1 },
      "url": { "type": "string", "format": "uri" },
      "category": {
        "type": "string",
        "enum": ["official_program", "university", "aggregator", "government", "foundation"]
      },
      "scrape_method": {
        "type": "string",
        "enum": ["api", "scrape", "scrapling", "rss", "inertia"]
      },
      "trust_level": {
        "type": "string",
        "enum": ["auto_publish", "needs_review", "blocked"],
        "default": "needs_review"
      },
      "scrape_frequency_hours": { "type": "number", "minimum": 1 },
      "wave": { "type": "integer", "minimum": 1, "maximum": 7 },
      "is_active": { "type": "boolean" },
      "auth_required": { "type": "boolean", "default": false },
      "has_api": { "type": "boolean", "default": false },
      "estimated_volume": { "type": "string" },
      "geographic_coverage": {
        "type": "array",
        "items": { "type": "string" }
      },
      "notes": { "type": "string" }
    },
    "additionalProperties": false
  }
}
