[
  {
    "name": "ScholarshipPortal",
    "url": "https://www.scholarshipportal.com",
    "category": "aggregator",
    "scrape_method": "scrape",
    "trust_level": "needs_review",
    "scrape_frequency_hours": 168,
    "wave": 1,
    "is_active": true,
    "auth_required": false,
    "has_api": false,
    "estimated_volume": "~5000",
    "geographic_coverage": ["europe", "global"],
    "notes": "CF: no | Fields: title, deadline, amount, country, degree | Volume: ~5000 scholarships | Largest EU aggregator"
  },
  {
    "name": "DAAD Scholarships",
    "url": "https://www.daad.de/en/study-and-research-in-germany/scholarships/",
    "category": "official_program",
    "scrape_method": "api",
    "trust_level": "needs_review",
    "scrape_frequency_hours": 336,
    "wave": 6,
    "is_active": true,
    "auth_required": false,
    "has_api": true,
    "estimated_volume": "~200",
    "geographic_coverage": ["germany"],
    "notes": "API: https://www.daad.de/api | Fields: title, deadline, amount, eligibility | Volume: ~200 programs"
  },
  {
    "name": "UK Government Scholarships",
    "url": "https://www.gov.uk/government/collections/scholarships",
    "category": "government",
    "scrape_method": "scrape",
    "trust_level": "needs_review",
    "scrape_frequency_hours": 720,
    "wave": 7,
    "is_active": true,
    "auth_required": false,
    "has_api": false,
    "geographic_coverage": ["united-kingdom"],
    "notes": "Fields: title, deadline, eligibility | Volume: ~30 programs"
  },
  {
    "name": "Gates Cambridge",
    "url": "https://www.gatescambridge.org",
    "category": "foundation",
    "scrape_method": "scrape",
    "trust_level": "needs_review",
    "scrape_frequency_hours": 720,
    "wave": 7,
    "is_active": true,
    "auth_required": false,
    "has_api": false,
    "geographic_coverage": ["united-kingdom"],
    "notes": "Fields: title, deadline, eligibility | Volume: ~1 program | Highly competitive"
  },
  {
    "name": "MIT Financial Aid",
    "url": "https://sfs.mit.edu",
    "category": "university",
    "scrape_method": "scrapling",
    "trust_level": "needs_review",
    "scrape_frequency_hours": 720,
    "wave": 7,
    "is_active": true,
    "auth_required": false,
    "has_api": false,
    "geographic_coverage": ["united-states"],
    "notes": "CF: yes | Volume: ~50"
  }
]
